<?xml version="1.0" encoding="UTF-8"?>
<schema xmlns="http://www.w3.org/2001/XMLSchema"
        targetNamespace="http://itstep.org/students"
        xmlns:tns="http://itstep.org/students">
	<element name="students">
		<complexType>
			<sequence>
				<element name="student" type="tns:Student"
				         minOccurs="1" maxOccurs="unbounded"/>
			</sequence>
		</complexType>
	</element>

	<complexType name="Student">
		<sequence>
			<element name="name" type="string"/>
			<element name="phone" type="decimal"/>
			<element name="address" type="tns:Address"/>
		</sequence>
		<attribute name="login" type="tns:Login" use="required"/>
		<attribute name="faculty" type="string" use="required"/>
	</complexType>

	<simpleType name="Login">
		<restriction base="ID">
			<pattern value=".*"/>
		</restriction>
	</simpleType>

	<complexType name="Address">
		<sequence>
			<element name="country" type="string"/>
			<element name="city" type="string"/>
			<element name="street" type="string"/>
		</sequence>
	</complexType>

</schema>